<!ELEMENT programming-languages (lenguaje+)>
<!ATTLIST programming-languages xmlns:xsi CDATA #IMPLIED
                xsi:noNamespaceSchemaLocation CDATA #IMPLIED>
<!ELEMENT lenguaje (descripcion,example)>
<!ATTLIST lenguaje name ID #REQUIRED>
<!ELEMENT descripcion (#PCDATA)>
<!ELEMENT example (#PCDATA)>